<xs:schema xmlns:xs="http://www.w3.org/2001/XMLSchema">
    <xs:element name="config">
        <xs:complexType>
            <xs:sequence>
                <xs:element name="dataDir" type="xs:string"/>
                <xs:element name="datetimeFormat">
                    <xs:complexType>
                        <xs:sequence>
                            <xs:element name="timeStrFormat" type="xs:string"/>
                            <xs:element name="timeZone" type="xs:string"/>
                        </xs:sequence>
                    </xs:complexType>
                </xs:element>
                <xs:element name="userModel">
                    <xs:complexType>
                        <xs:sequence>
                            <xs:element name="model" type="xs:string" minOccurs="0" maxOccurs="unbounded"/>
                        </xs:sequence>
                    </xs:complexType>
                </xs:element>
                <xs:element name="digest-algorithm" type="xs:string"/>
                <xs:element name="welcomePage" type="xs:string"/>
            </xs:sequence>
        </xs:complexType>
    </xs:element>
</xs:schema>